<?xml version="1.0" encoding="UTF-8" standalone="yes"?>
<profile schemaVersion="5" id="trinidad" name="Trinidad JSF" common="true" created-on="2015-02-24T12:00:00" description="Profile for the Apache MyFaces Trinidad JSF framework."
	xmlns:xs="http://www.w3.org/2001/XMLSchema" xmlns:xsi="http://www.w3.org/2001/XMLSchema-instance" xsi:noNamespaceSchemaLocation="../../schema/ciSchema.xsd">

	<sensor-assignment-profile-data>
		<timer-method-sensor-assignment sensor-config-class="rocks.inspectit.shared.cs.ci.sensor.method.impl.TimerSensorConfig" class-name="org.apache.myfaces.trinidad.render.CoreRenderer" method-name="*" private-mod="false" protected-mod="false" default-mod="false" />

		<timer-method-sensor-assignment sensor-config-class="rocks.inspectit.shared.cs.ci.sensor.method.impl.TimerSensorConfig" class-name="org.apache.myfaces.trinidad.component.*" method-name="saveState" private-mod="false" protected-mod="false" default-mod="false" />
		<timer-method-sensor-assignment sensor-config-class="rocks.inspectit.shared.cs.ci.sensor.method.impl.TimerSensorConfig" class-name="org.apache.myfaces.trinidad.component.*" method-name="encodeBegin" private-mod="false" protected-mod="false" default-mod="false" />
		<timer-method-sensor-assignment sensor-config-class="rocks.inspectit.shared.cs.ci.sensor.method.impl.TimerSensorConfig" class-name="org.apache.myfaces.trinidad.component.*" method-name="encodeEnd" private-mod="false" protected-mod="false" default-mod="false" />
		<timer-method-sensor-assignment sensor-config-class="rocks.inspectit.shared.cs.ci.sensor.method.impl.TimerSensorConfig" class-name="org.apache.myfaces.trinidad.component.*" method-name="encodeAll" private-mod="false" protected-mod="false" default-mod="false" />
		<timer-method-sensor-assignment sensor-config-class="rocks.inspectit.shared.cs.ci.sensor.method.impl.TimerSensorConfig" class-name="org.apache.myfaces.trinidad.component.*" method-name="processSaveState" private-mod="false" protected-mod="false" default-mod="false" />
		<timer-method-sensor-assignment sensor-config-class="rocks.inspectit.shared.cs.ci.sensor.method.impl.TimerSensorConfig" class-name="org.apache.myfaces.trinidad.component.*" method-name="processDecodes" private-mod="false" protected-mod="false" default-mod="false" />
		<timer-method-sensor-assignment sensor-config-class="rocks.inspectit.shared.cs.ci.sensor.method.impl.TimerSensorConfig" class-name="org.apache.myfaces.trinidad.component.*" method-name="processValidators" private-mod="false" protected-mod="false" default-mod="false" />
		<timer-method-sensor-assignment sensor-config-class="rocks.inspectit.shared.cs.ci.sensor.method.impl.TimerSensorConfig" class-name="org.apache.myfaces.trinidad.component.*" method-name="processUpdates" private-mod="false" protected-mod="false" default-mod="false" />
		<timer-method-sensor-assignment sensor-config-class="rocks.inspectit.shared.cs.ci.sensor.method.impl.TimerSensorConfig" class-name="org.apache.myfaces.trinidad.component.*" method-name="processRestoreState" private-mod="false" protected-mod="false" default-mod="false" />
		<timer-method-sensor-assignment sensor-config-class="rocks.inspectit.shared.cs.ci.sensor.method.impl.TimerSensorConfig" class-name="org.apache.myfaces.trinidad.component.*" method-name="restoreState" private-mod="false" protected-mod="false" default-mod="false" />
	</sensor-assignment-profile-data>
	
</profile>