<?xml version="1.0" encoding="UTF-8" standalone="yes"?>
<profile id="hibernate" name="Hibernate" common="true" created-on="2015-02-24T12:00:00" description="Profile for the Hibernate framework."
	xmlns:xs="http://www.w3.org/2001/XMLSchema" xmlns:xsi="http://www.w3.org/2001/XMLSchema-instance" xsi:noNamespaceSchemaLocation="../../schema/ciSchema.xsd">

	<!-- Hibernate-->
	<timer-method-sensor-assignment sensor-config-class="info.novatec.inspectit.ci.sensor.method.impl.TimerSensorConfig" class-name="org.hibernate.impl.QueryImpl" method-name="*" private-mod="false" protected-mod="false" default-mod="false" />

	<timer-method-sensor-assignment sensor-config-class="info.novatec.inspectit.ci.sensor.method.impl.TimerSensorConfig" class-name="org.hibernate.impl.SessionImpl" method-name="load" private-mod="false" protected-mod="false" default-mod="false" />
	<timer-method-sensor-assignment sensor-config-class="info.novatec.inspectit.ci.sensor.method.impl.TimerSensorConfig" class-name="org.hibernate.impl.SessionImpl" method-name="get" private-mod="false" protected-mod="false" default-mod="false" />
	<timer-method-sensor-assignment sensor-config-class="info.novatec.inspectit.ci.sensor.method.impl.TimerSensorConfig" class-name="org.hibernate.impl.SessionImpl" method-name="evict" private-mod="false" protected-mod="false" default-mod="false" />
	<timer-method-sensor-assignment sensor-config-class="info.novatec.inspectit.ci.sensor.method.impl.TimerSensorConfig" class-name="org.hibernate.impl.SessionImpl" method-name="flush" private-mod="false" protected-mod="false" default-mod="false" />
	<timer-method-sensor-assignment sensor-config-class="info.novatec.inspectit.ci.sensor.method.impl.TimerSensorConfig" class-name="org.hibernate.impl.SessionImpl" method-name="forceFlush" private-mod="false" protected-mod="false" default-mod="false" />
	<timer-method-sensor-assignment sensor-config-class="info.novatec.inspectit.ci.sensor.method.impl.TimerSensorConfig" class-name="org.hibernate.impl.SessionImpl" method-name="find" private-mod="false" protected-mod="false" default-mod="false" />
	<timer-method-sensor-assignment sensor-config-class="info.novatec.inspectit.ci.sensor.method.impl.TimerSensorConfig" class-name="org.hibernate.impl.SessionImpl" method-name="list" private-mod="false" protected-mod="false" default-mod="false" />
	<timer-method-sensor-assignment sensor-config-class="info.novatec.inspectit.ci.sensor.method.impl.TimerSensorConfig" class-name="org.hibernate.impl.SessionImpl" method-name="iterate" private-mod="false" protected-mod="false" default-mod="false" />
	<timer-method-sensor-assignment sensor-config-class="info.novatec.inspectit.ci.sensor.method.impl.TimerSensorConfig" class-name="org.hibernate.impl.SessionImpl" method-name="delete" private-mod="false" protected-mod="false" default-mod="false" />
	<timer-method-sensor-assignment sensor-config-class="info.novatec.inspectit.ci.sensor.method.impl.TimerSensorConfig" class-name="org.hibernate.impl.SessionImpl" method-name="executeUpdate" private-mod="false" protected-mod="false" default-mod="false" />
	<timer-method-sensor-assignment sensor-config-class="info.novatec.inspectit.ci.sensor.method.impl.TimerSensorConfig" class-name="org.hibernate.impl.SessionImpl" method-name="executeNativeUpdate" private-mod="false" protected-mod="false" default-mod="false" />

	<timer-method-sensor-assignment sensor-config-class="info.novatec.inspectit.ci.sensor.method.impl.TimerSensorConfig" class-name="org.hibernate.impl.SessionFactoryImpl" method-name="openSession" private-mod="false" protected-mod="false" default-mod="false" />

</profile>