<?xml version="1.0" encoding="UTF-8" standalone="yes"?>
<profile id="jsf" name="JSF" common="true" created-on="2015-02-24T12:00:00" description="Profile for the Java Server Faces."
	xmlns:xs="http://www.w3.org/2001/XMLSchema" xmlns:xsi="http://www.w3.org/2001/XMLSchema-instance" xsi:noNamespaceSchemaLocation="../../schema/ciSchema.xsd">

	<timer-method-sensor-assignment sensor-config-class="info.novatec.inspectit.ci.sensor.method.impl.TimerSensorConfig" class-name="javax.faces.webapp.UIComponentClassicTagBase" method-name="*" private-mod="false" protected-mod="false" default-mod="false" />

	<timer-method-sensor-assignment sensor-config-class="info.novatec.inspectit.ci.sensor.method.impl.TimerSensorConfig" class-name="javax.faces.component.*" method-name="processDecodes" private-mod="false" protected-mod="false" default-mod="false" />
	<timer-method-sensor-assignment sensor-config-class="info.novatec.inspectit.ci.sensor.method.impl.TimerSensorConfig" class-name="javax.faces.component.*" method-name="processRestoreState" private-mod="false" protected-mod="false" default-mod="false" />
	<timer-method-sensor-assignment sensor-config-class="info.novatec.inspectit.ci.sensor.method.impl.TimerSensorConfig" class-name="javax.faces.component.*" method-name="processSaveState" private-mod="false" protected-mod="false" default-mod="false" />
	<timer-method-sensor-assignment sensor-config-class="info.novatec.inspectit.ci.sensor.method.impl.TimerSensorConfig" class-name="javax.faces.component.*" method-name="processUpdates" private-mod="false" protected-mod="false" default-mod="false" />
	<timer-method-sensor-assignment sensor-config-class="info.novatec.inspectit.ci.sensor.method.impl.TimerSensorConfig" class-name="javax.faces.component.*" method-name="processValidators" private-mod="false" protected-mod="false" default-mod="false" />
	<timer-method-sensor-assignment sensor-config-class="info.novatec.inspectit.ci.sensor.method.impl.TimerSensorConfig" class-name="javax.faces.component.*" method-name="saveState" private-mod="false" protected-mod="false" default-mod="false" />
	<timer-method-sensor-assignment sensor-config-class="info.novatec.inspectit.ci.sensor.method.impl.TimerSensorConfig" class-name="javax.faces.component.*" method-name="restoreState" private-mod="false" protected-mod="false" default-mod="false" />
</profile>